<!ELEMENT menu (meals, beverages)>
<!ELEMENT meals (meal+)>
<!ELEMENT meal (name, price, description, image)>
<!ELEMENT beverages (coffee, otherBeverages)>
<!ELEMENT coffee (size+, price+, description)>
<!ELEMENT size (#PCDATA)>
<!ELEMENT price (#PCDATA)>
<!ELEMENT description (#PCDATA)>
<!ELEMENT otherBeverages (otherBeverage+)>
<!ELEMENT otherBeverage (name, price)>
<!ELEMENT name (#PCDATA)>
<!ELEMENT price (#PCDATA)>
<!ELEMENT description (#PCDATA)>
<!ELEMENT image (#PCDATA)>
